{
  "$schema": "urn:openaix:schema:measure-cl:0.1.0-draft.2",
  "active": {
    "end": "2026-10-02T15:00:00Z",
    "start": "2026-10-02T13:00:00Z"
  },
  "geometry": {
    "kind": "vertical",
    "level": {
      "reference": "MSL",
      "unit": "ft",
      "value": 11000
    }
  },
  "id": "bastion-ca",
  "name": "OIR coordinating altitude",
  "type": "CA"
}
